{
  "member_id": "TW-MEMBER-founder",
  "display_name": "Robert J. Hayes",
  "bio": "Founder of Project Unveiled. This profile is public so every stated belief can be examined, challenged, revised, and linked to evidence.",
  "profile_visibility": "public",
  "positions": [
    {
      "position_id": "POS-SALVATION-001",
      "topic": "Salvation",
      "p": "Jesus taught that salvation requires repeating a specific prescribed prayer or verbal formula.",
      "not_p": "Jesus did not teach that salvation requires repeating a specific prescribed prayer or verbal formula.",
      "stance": "holds-not-p",
      "member_explanation": "My present position is that Jesus' recorded teaching emphasizes inward belief, repentance, allegiance, following, love, fruit, and lived response rather than one mandatory scripted prayer. This position is open to challenge.",
      "evidence": [
        {"evidence_id":"E1","position":"supports-not-p","citation":"Mark 1:14-15","url":null,"note":"Repent and believe language; no prescribed formula."},
        {"evidence_id":"E2","position":"supports-not-p","citation":"John 3:1-21","url":null,"note":"New birth, belief, and coming to the light; no prescribed formula."},
        {"evidence_id":"E3","position":"supports-p","citation":"Romans 10:9-13","url":null,"note":"Important counterevidence because confession and belief are explicitly connected with salvation."}
      ],
      "linked_truth_trials": ["TW-CASE-000001"],
      "open_challenges": [],
      "resolved_challenges": [],
      "revision_history": [
        {"date":"2026-08-22","from":"not-investigated","to":"holds-not-p","reason":"Initial public position linked to Truth Trial #000001.","truth_trial_id":"TW-CASE-000001","challenge_id":null}
      ]
    },
    {
      "position_id": "POS-KINGDOM-001",
      "topic": "Kingdom of God",
      "p": "Jesus taught that the Kingdom of God is present within or among people rather than only a future external realm.",
      "not_p": "Jesus taught that the Kingdom of God is only a future external realm and not presently within or among people.",
      "stance": "holds-p",
      "member_explanation": "This is a working theological position that requires deeper lexical and contextual investigation, especially Luke 17:20-21 and the phrase entos hymon.",
      "evidence": [
        {"evidence_id":"E1","position":"supports-p","citation":"Luke 17:20-21","url":null,"note":"Central text; translation and audience context remain material to the interpretation."}
      ],
      "linked_truth_trials": [],
      "open_challenges": [],
      "resolved_challenges": [],
      "revision_history": [
        {"date":"2026-08-22","from":"not-investigated","to":"holds-p","reason":"Initial public working position; formal Truth Trial still needed.","truth_trial_id":null,"challenge_id":null}
      ]
    }
  ],
  "contributions": {
    "primary_sources_contributed": 0,
    "successful_challenges": 0,
    "corrections_accepted": 0,
    "truth_trials_participated": 1
  },
  "created_at": "2026-08-22T07:30:00-05:00",
  "updated_at": "2026-08-22T07:30:00-05:00"
}